"ISBN";"Book-Title";"Book-Author";"Year-Of-Publication";"Publisher";"Image-URL"
"001V";"Cây Cam Ngọt Của Tôi";"José Mauro de Vasconcelos";"2020";"NXB Hội Nhà Văn";"https://cdn0.fahasa.com/media/catalog/product/i/m/image_217480.jpg"
"002V";"Một Ví Dụ Xoàng (Tái Bản 2023)";"Nguyễn Bình Phương";"2023";"Hội Nhà Văn";"https://cdn0.fahasa.com/media/catalog/product/m/o/mot-vi-du-xoang-2023.jpg"
"003V";"Những Ta";"Lê Minh Hà";"2024";"Hội Nhà Văn";"https://cdn0.fahasa.com/media/catalog/product/z/5/z5038318151982_a6570cc4d9a03accf85a613f691d8b90.jpg"
"004V";"Búi Thông Thơ Dại";"Đỗ Doãn Hoàng";"2019";"NXB Hội Nhà Văn";"https://cdn0.fahasa.com/media/catalog/product/i/m/image_187831.jpg"
"005V";"Trốn Lên Mái Nhà Để Khóc";"Lam";"2023";"Dân Trí";"https://cdn0.fahasa.com/media/catalog/product/b/_/b_a-1-tr_n-l_n-m_i-nh_-_-kh_c-2.jpg"
"006V";"Và Để Cơn Mưa Nằm Yên";"Zelda";"2022";"Dân Trí";"https://cdn0.fahasa.com/media/catalog/product/3/9/392933.jpg"
"007V";"Từ Điển Tiếng “Em” - Tái Bản 2021";"Khotudien";"2021";"NXB Phụ Nữ Việt Nam";"https://cdn0.fahasa.com/media/catalog/product/b/i/bia_tudientiengem-_1_.jpg"
"008V";"Vui Vẻ Không Quạu Nha 2 - Một Cuốn Sách Buồn… Cười";"Ở Đây Zui Nè";"2021";"	NXB Phụ Nữ Việt Nam";"https://cdn0.fahasa.com/media/catalog/product/8/9/8935325000157.jpg"
"009V";"Điều Còn Lại Giữa Chúng Ta";"Jun Và An.";"2023";"Phụ Nữ Việt Nam";"https://cdn0.fahasa.com/media/catalog/product/b/i/bia-chinh-_i_u-c_n-l_i-gi_a-ch_ng-ta.jpg"
"010V";"Dài Hơn Một Mùa Hè";"Lu";"2023";"Phụ Nữ Việt Nam";"https://cdn0.fahasa.com/media/catalog/product/b/_/b_a-1---d_i-h_n-1-m_a-h_1.jpg"
"011V";"Dear, Darling";"Hiên";"2022";"Phụ Nữ Việt Nam";"https://cdn0.fahasa.com/media/catalog/product/8/9/8935325004896_1.jpg"
"012V";"Trả Lại Nụ Hôn";"Dương Thụy";"2018";"NXB Trẻ";"https://cdn0.fahasa.com/media/catalog/product/8/9/8934974152750.jpg"
"013V";"Sông (Tái Bàn 2020)";"Nguyễn Ngọc Tư";"2020";"NXB Trẻ";"https://cdn0.fahasa.com/media/catalog/product/i/m/image_195509_1_44277.jpg"
"014V";"Người Quảng Đi Ăn Mì Quảng (Tái Bản)";"Nguyễn Nhật Ánh";"2018";"NXB Trẻ";"https://cdn0.fahasa.com/media/catalog/product/8/9/8934974155317.jpg"
"015V";"Sài Gòn Chọn Nhớ Những Điều Thương - Cách Chúng Ta Cùng Nhau Đi Qua Đại Dịch";"Nhiều Tác Giả";"2022";"NXB Trẻ";"https://cdn0.fahasa.com/media/catalog/product/8/9/8934974175667_11.jpg"
"016V";"Học Yêu Mình Sau Muôn Vẻ Nỗi Đau - Tặng Kèm Bookmark";"Yến Nhi";"2023";"Hà Nội";"https://cdn0.fahasa.com/media/catalog/product/b/i/bia_hoc-yeu-minh-sau-muon-ve-noi-dau-1.jpg"
"017V";"Lê Minh Khuê - Tuyển Tập Truyện Ngắn Và Vừa";"Lê Minh Khuê";"2019";"NXB Trẻ";"https://cdn0.fahasa.com/media/catalog/product/i/m/image_195509_1_575.jpg"
"018V";"Nhớ (Tái Bản 2021)";"Mạc Can";"2021";"	NXB Trẻ";"https://cdn0.fahasa.com/media/catalog/product/i/m/image_237217.jpg"
"019V";"Hát Mãi Một Mình";"Đỗ Phấn";"2019";"NXB Trẻ";"https://cdn0.fahasa.com/media/catalog/product/i/m/image_186651.jpg"
"020V";"Tôi Bị Cảm Hóa Ra Là Do Em";"Phạm Duy Phước";"2023";"Phụ Nữ Việt Nam";"https://cdn0.fahasa.com/media/catalog/product/9/7/9786044725901.jpg"
"021V";"Một Người Đi Tiếp, Một Người Quẩn Quanh";"Châu Sa Đáy Mắt";"2023";"Phụ Nữ Việt Nam";"https://cdn0.fahasa.com/media/catalog/product/b/_/b_a-tr_c-1_2.jpg"
"022V";"Đổi Nụ Cười Lấy Bên Người Trăm Năm - Tặng Kèm Bookmark + 2 Postcard";"Thủy Vũ";"2021";"NXB Phụ Nữ Việt Nam";"https://cdn0.fahasa.com/media/catalog/product/b/i/bia_doi-nu-cuoi-lay-ben-nguoi-tram-nam.jpg"
"023V";"Chọn Cô Đơn Giữa Biển Người Vô Tận";"Huỳnh Thắng";"2023";"Phụ Nữ Việt Nam";"https://cdn0.fahasa.com/media/catalog/product/b/i/bia_chon-co-don-giua-bien-nguoi-vo-tan-_glowbooks_.jpg"
"024V";"Hôm Nay Thương Nhớ Rơi Vỡ Lòng Ai - Tặng Kèm Bookmark + Postcard";"A Tòn";"2023";"Phụ Nữ Việt Nam";"https://cdn0.fahasa.com/media/catalog/product/b/_/b_a-s_chh_m-nay-th_ng-nh_-r_i-v_-l_ng-ai-600.jpg"
"025V";"Ngày Nắng Đem Nỗi Buồn Ra Phơi";"Thỏ con lon ton";"2023";"Phụ Nữ Việt Nam";"https://cdn0.fahasa.com/media/catalog/product/b/_/b_a-1-ng_y-n_ng-_em-n_i-bu_n-ra-ph_i.jpg"
"026V";"Về Nghe Yêu Kể";"Minh Chính MCs";"2022";"NXB Phụ Nữ Việt Nam";"https://cdn0.fahasa.com/media/catalog/product/b/i/bia_ve-nghe-yeu-ke.jpg"
"027V";"Tôi Đã Yêu Người Âm Thầm Như Thế";"Anna Turner";"2020";"NXB Lao Động";"https://cdn0.fahasa.com/media/catalog/product/i/m/image_216565.jpg"
"028V";"Mỗi Vết Thương Là Một Lần Trưởng Thành";"Phoenix Do";"2023";"Lao Động";"https://cdn0.fahasa.com/media/catalog/product/b/i/bia-1-vet-thuong.jpg"
"029V";"Những Ngày Buồn Chóng Qua";"Thắng , Nguyên Bảo , Nguyên Nguyên , Ánh Mai";"2017";"Lao Động";"https://cdn0.fahasa.com/media/wysiwyg/hieu_kd/2023-08-frame/FrameAds_03_1080X1080.png"
"030V";"Thương Nhớ Người Dưng";"Dương Thùy";"2018";"NXB Lao Động";"https://cdn0.fahasa.com/media/wysiwyg/hieu_kd/2023-08-frame/FrameAds_03_1080X1080.png"
"031V";"Ngày Tháng Nào Đã Ra Đi";"Hồng Bối";"2020";"NXB Lao Động";"https://cdn0.fahasa.com/media/catalog/product/i/m/image_195509_1_56133.jpg"
"032V";"Hoa Giữa Trời";"Nguyên Sinh";"2022";"NXB Lao Động";"https://cdn0.fahasa.com/media/catalog/product/8/9/8935280911055.jpg"
"033V";"Chúng Ta Rồi Sẽ Hạnh Phúc, Theo Những Cách Khác Nhau";"Thảo Thảo";"2021";"NXB Văn Học";"https://cdn0.fahasa.com/media/catalog/product/1/3/139990755_1302883240068333_3844579474690419303_n.jpg"
"034V";"Làm Bạn Với Bầu Trời - Tặng Kèm Khung Hình Xinh Xắn";"Nguyễn Nhật Ánh";"2019";"NXB Trẻ";"https://cdn0.fahasa.com/media/catalog/product/u/n/untitled-2_44.jpg"
"035V";"Chưa Kịp Lớn Đã Trưởng Thành (Tái Bản 2023)";"Tớ Là Mây";"2023";"Dân Trí";"https://cdn0.fahasa.com/media/catalog/product/9/7/9726a839a056959e94aba54e7c1ff0d6_1_1.jpg"
"036V";"Đi Hết Một Đời Anh Vẫn Là Của Em (Tái Bản)";"Lan Rùa";"2021";"NXB Dân Trí";"https://cdn0.fahasa.com/media/catalog/product/9/7/9786043445084.jpg"
"037V";"Màu Xanh Trong Suốt";"Ryu Murakami";"2022";"Dân Trí";"https://cdn0.fahasa.com/media/wysiwyg/hieu_kd/2023-08-frame/FrameAds_03_1080X1080.png"
"038V";"Lén Nhặt Chuyện Đời";"Mộc Trầm";"2022";"Thế Giới";"https://cdn0.fahasa.com/media/catalog/product/9/7/9786043651591_1.jpg"
"039V";"Bức Thư Tình Có Vị Ngọt Của Bánh";"Thái La";"2020";"Thế Giới";"https://cdn0.fahasa.com/media/catalog/product/i/m/image_195509_1_55416.jpg"
"040V";"Đợi Một Danh Phận, Cả Đời Oán Hận";"Lan Rùa";"2022";"NXB Dân Trí";"https://cdn0.fahasa.com/media/catalog/product/z/3/z3491985714441_56cba2c936e26f0e7e3ace97a786b4fd-_1_.jpg"
"041V";"Chuyện Kể Rằng Có Nàng Và Tôi";"Nhiều Tác Giả";"2022";"NXB Phụ Nữ Việt Nam";"https://cdn0.fahasa.com/media/catalog/product/b/i/bia_chuyen-ke-rang-co-nang-va-toi_final.jpg"
"042V";"Tôi Có Triệu Chứng Cứ Yêu Em";"Nhiều Tác Giả";"2023";"NXB Phụ Nữ Việt Nam";"https://cdn0.fahasa.com/media/catalog/product/t/c/tctccye.jpg"
"043V";"Chắc Gì Ta Đã Yêu Nhau (Tái Bản 2022)";"Minh Nhật";"2022";"Phụ Nữ Việt Nam";"https://cdn0.fahasa.com/media/catalog/product/c/h/ch_c-g_-ta-_-y_u-nhau-_t_i-b_n-2022_b_a-s_ch.jpg"
"044V";"Chim Trời Bay Về Sau Cơn Mưa";"Ma Văn Kháng";"2023";"Phụ Nữ Việt Nam";"https://cdn0.fahasa.com/media/catalog/product/c/h/chim-tr_i_1.jpg"
"045V";"Chí Phèo";"Nam Cao";"2022";"NXB Văn Học";"https://cdn0.fahasa.com/media/wysiwyg/hieu_kd/2023-08-frame/FrameAds_03_1080X1080.png"
"046V";"Tuyển Tập Truyện Ngắn - Chí Phèo (Tái Bản 2018)";"Nam Cao";"2018";"NXB Văn Học";"https://cdn0.fahasa.com/media/wysiwyg/hieu_kd/2023-08-frame/FrameAds_03_1080X1080.png"
"047V";"Danh Tác Việt Nam - Đôi Mắt";"Nam Cao";"2023";"NXB Văn Học";"https://cdn0.fahasa.com/media/catalog/product/9/7/9786043940350.jpg"
"048V";"Năm Tháng Tĩnh Lặng, Kiếp Này Bình Yên - Tái Bản 2021";"Bạch Lạc Mai";"2021";"Lao Động";"https://cdn0.fahasa.com/media/catalog/product/b/i/bia-1_nam-thang-tinh-lang_tb2021.jpg"
"049V";"Ngoảnh Lại Đã Một Đời";"Bạch Lạc Mai";"2019";"NXB Hà Nội";"https://cdn0.fahasa.com/media/catalog/product/b/i/bia-1_ngoanh-lai-da-mot-doi.jpg"
"050V";"Cuối Con Đường Sẽ Gặp Một Người Thương - Tặng Kèm Bookmark";"Trí";"2023";"Văn Học";"https://cdn0.fahasa.com/media/catalog/product/0/2/021123-8.jpg"
"051E";"SAT Math Prep: Over 400 Practice Questions + Online (Kaplan Test Prep)";"Kaplan Test Prep";"2020";"Kaplan Publishing";"https://cdn0.fahasa.com/media/catalog/product/i/m/image_244718_1_2809.jpg"
"052E";"English Grammar in Use Book w Ans";"Raymond Murphy";"2017";"Cambridge University";"https://cdn0.fahasa.com/media/catalog/product/9/7/9781108430425.jpg"
"053E";"A Clash Of Kings";"George R. R. Martin";"1999";"HarperCollins";"https://cdn0.fahasa.com/media/catalog/product/9/7/9780006479895_1.jpg"
"054E";"Wonder Woman: Warbringer";"Leigh Bardugo";"2017";"Random House LCC US";"https://cdn0.fahasa.com/media/catalog/product/9/7/9781524770983_1.jpg"
"055E";"The Scorch Trials (Maze Runner, Book 2)";"James Dashner";"2011";"Ember";"https://cdn0.fahasa.com/media/catalog/product/9/7/9780385738767.jpg"
"056E";"This Shattered World: A Starbound Novel";"Amie Kaufman, Meagan Spooner";"2014";"Disney-Hyperion";"https://cdn0.fahasa.com/media/catalog/product/i/m/image_119940.jpg"
"057E";"The Book Of Tea 2: A Venom Dark And Sweet";"Judy I. Lin";"2022";"	Feiwel & Friends";"https://cdn0.fahasa.com/media/catalog/product/9/7/9781250767103.jpg"
"058E";"Kingdom Of Three 1: Strike The Zither";"Joan He";"2022";"Roaring Brook";"https://cdn0.fahasa.com/media/catalog/product/9/7/9781250258588.jpg"
"059E";"Summoner 1: The Novice";"Taran Matharu";"2016";"Hachette Children's Group";"https://cdn0.fahasa.com/media/catalog/product/9/7/9781444923995.jpg"
"060E";"Legend. by Marie Lu";"Marie Lu";"2012";"Puffin Books";"https://cdn0.fahasa.com/media/catalog/product/9/7/9780141339603b.jpg"
"061E";"The Official Cambridge Guide to IELTS Student's Book with Answers with DVD-ROM";"Pauline Cullen, Amanda French, Vanessa Jakeman";"2014";"Cambridge";"https://cdn0.fahasa.com/media/catalog/product/f/_/f.jpg"
"062E";"Compact First for Schools Workbook Without Answers with Audio-CD";"Barbara Thomas,Laura Matthews";"2013";"CAMBRIDGE UNIVERSITY PRESS";"https://cdn0.fahasa.com/media/catalog/product/i/m/image_195509_1_25079.jpg"
"063E";"Moonshot: Inside Pfizer's Nine-month Race To Make The Impossible Possible";"Albert Bourla";"2022";"HarperCollins";"https://cdn0.fahasa.com/media/catalog/product/9/7/9780008503994.jpg"
"064E";"The Woman In Me";"Britney Spears";"2023";"Gallery Books";"https://cdn0.fahasa.com/media/catalog/product/9/7/9781668009048bia.jpg"
"065E";"Father Of Lions";"Louise Callaghan";"2020";"Forge Trade";"https://cdn0.fahasa.com/media/catalog/product/i/m/image_234645.jpg"
"066E";"Will";"Will Smith, Mark Manson";"2021";"Penguin";"https://cdn0.fahasa.com/media/catalog/product/9/7/9781984879868.jpg"
"067E";"Boy Erased: A Memoir of Identity, Faith, and Family";"Garrard Conley";"2017";"Riverhead Books";"https://cdn0.fahasa.com/media/catalog/product/i/m/image_173164.jpg"
"068E";"Have A Little Faith";"Mitch Albom";"2010";"Sphere";"https://cdn0.fahasa.com/media/catalog/product/9/7/9780751537512_2.jpg"
"069E";"Impact: A Step-By-Step Plan To Create The World You Want To Live In";"Christen Brandt, Tammy Tibbetts";"2023";"PublicAffairs";"https://cdn0.fahasa.com/media/catalog/product/9/7/9781541756793.jpg"
"070E";"Shorter: Redesign Your Work And Reclaim Your Time";"Alex Soojung-Kim Pang";"2020";"PublicAffairs";"https://cdn0.fahasa.com/media/catalog/product/9/7/9781541757127.jpg"
"071E";"DO LUNCH OR BE LUNCH";"Jeffrey Cruikshank";"1997";"Harvard Business Review Press";"https://cdn0.fahasa.com/media/catalog/product/i/m/image_181659.jpg"
"072E";"You're It: Crisis, Change, And How To Lead When It Matters Most";"	Leonard J. Marcus, Eric J. McNulty, Joseph M. Henderson, Barry C. Dorn";"2021";"PublicAffairs";"https://cdn0.fahasa.com/media/catalog/product/9/7/9781541768048.jpg"
"073E";"The Infinite Leader: Balancing The Demands Of Modern Business Leadership (Kogan Page Inspire)";"Chris Lewis, Pippa Malmgren";"2020";"Kogan Page";"https://cdn0.fahasa.com/media/catalog/product/i/m/image_244009.jpg"
"074E";"You Lead: How Being Yourself Makes You A Better Leader";"Minter Dial";"2021";"Kogan Page";"https://cdn0.fahasa.com/media/catalog/product/i/m/image_244385.jpg"
"075E";"Disruption Proof: Empower People, Create Value, Drive Change";"Brant Cooper";"2021";"Grand Central Publishing";"https://cdn0.fahasa.com/media/catalog/product/9/7/9781538720196.jpg"
"076V";"Có Một Ngày, Bố Mẹ Sẽ Già Đi";"Nhiều Tác Giả";"2020";"NXB Thế Giới";"https://cdn0.fahasa.com/media/catalog/product/c/o/co-mot-ngay-bo-me-se-gia-di.jpg"
"077V";"Mùa Đi Qua Phố";"Nhiều Tác Giả";"2022";"Tổng Hợp TPHCM";"https://cdn0.fahasa.com/media/catalog/product/9/7/9786043774160.jpg"
"078V";"Yêu Đi Rồi Khóc (Tái Bản 2019)";"Hamlet Trương";"2019";"NXB Văn Học";"https://cdn0.fahasa.com/media/wysiwyg/hieu_kd/2023-08-frame/FrameAds_03_1080X1080.png"
"079V";"Thương Nhau Đến Ngày Sau";"Nhiều Tác Giả";"2023";"NXB Văn Học";"https://cdn0.fahasa.com/media/catalog/product/9/7/9786044773896.jpg"
"080V";"Không Đầu, Không Cuối, Không Biết Tại Sao";"Nhiều Tác Giả";"2023";"NXB Văn Học";"https://cdn0.fahasa.com/media/catalog/product/i/m/image_195509_1_7078.jpg"
"081V";"Những Đoản Khúc Mơ";"Nhiều Tác Giả";"2022";"NXB Văn Học";"https://cdn0.fahasa.com/media/catalog/product/8/9/8936107813231.jpg"
"082V";"Nỗi Buồn Chiến Tranh (Tái Bản 2022)";"Bảo Ninh";"2022";"NXB Trẻ";"https://cdn0.fahasa.com/media/catalog/product/8/9/8934974180098_1.jpg"
"083V";"Những Giấc Mơ Bay Tự Do - Hiệu Ứng Covid19 - Nghĩ Mới Về Những Chuyến Đi Cũ";"Trần Ngọc Châu";"2022";"NBX Trẻ";"https://cdn0.fahasa.com/media/catalog/product/8/9/8934974183167.jpg"
"084V";"Những Đêm Sương";"Ngọc Giao";"2021";"NXB Trẻ";"https://cdn0.fahasa.com/media/catalog/product/i/m/image_228750.jpg"
"085V";"Mối Tình Cuối Cùng";"Bình Nguyên Lộc";"2019";"NXB Trẻ";"https://cdn0.fahasa.com/media/catalog/product/i/m/image_184790.jpg"
"086V";"Tình Yêu Và Thù Hận";"Bà Tùng Long";"2021";"Trẻ";"https://cdn0.fahasa.com/media/catalog/product/i/m/image_241042.jpg"
"087V";"Hoa Vẫn Nở Mỗi Ngày";"Valérie Perrin";"2020";"Hà Nội";"https://cdn0.fahasa.com/media/catalog/product/i/m/image_206332.jpg"
"088V";"Tớ Thích Cậu Hơn Cả Harvard (Tái Bản 2023)";"Lan Rùa";"2023";"Dân Trí";"https://cdn0.fahasa.com/media/catalog/product/9/7/9786048888909.jpg"
"089V";"Nhớ Ai Đó Đến Kiệt Quệ";"Lan Rùa";"2023";"Dân Trí";"https://cdn0.fahasa.com/media/catalog/product/9/7/9786048888893.jpg"
"090V";"Bắt Đầu Cất Lên Tiếng Cười";"Hồ Anh Thái";"2021";"NXB Dân Trí";"https://cdn0.fahasa.com/media/catalog/product/i/m/image_238100.jpg"
"091V";"Ở Lại Để Chờ Nhau";"Hồ Anh Thái";"2020";"NXB Thế Giới";"https://cdn0.fahasa.com/media/catalog/product/i/m/image_195509_1_45372.jpg"
"092V";"Kiếp Ba Khía";"Trần Bảo Định";"2020";"NXB Tổng Hợp TPHCM";"https://cdn0.fahasa.com/media/catalog/product/i/m/image_195509_1_43653.jpg"
"093V";"Donald Trump Và Cô Bé Sài Gòn";"Lê Hoàng";"2017";"NXB Tổng Hợp TPHCM";"https://cdn0.fahasa.com/media/catalog/product/8/9/8935086844083.jpg"
"094V";"Con Chim Nhỏ Gắp Cọng Rơm Vàng";"Trần Huyền Trang";"2019";"NXB Tổng Hợp TPHCM";"https://cdn0.fahasa.com/media/catalog/product/i/m/image_195509_1_13562.jpg"
"095V";"Cô Bé Ngủ Trên Dây Điện";"Lê Đắc Hoàng Hựu";"2020";"NXB Tổng Hợp TPHCM";"https://cdn0.fahasa.com/media/catalog/product/c/o/co-be-ngu-tren-day-dien.jpg"
"096V";"Nè Cô Bé, Đừng Ngồi Trên Cửa Sổ";"Lê Đắc Hoàng Hựu";"2020";"NXB Tổng Hợp TPHCM";"https://cdn0.fahasa.com/media/catalog/product/n/e/ne-co-be-dung-ngoi-tren-cua-so.jpg"
"097V";"Oán Thù Trớ Trêu";"Lại Văn Long";"2019";"NXB Tổng Hợp TPHCM";"https://cdn0.fahasa.com/media/catalog/product/i/m/image_184171.jpg"
"098V";"Tess - Một Tâm Hồn Trong Trắng";"Thomas Hardy";"2020";"NXB Tổng Hợp TPHCM";"https://cdn0.fahasa.com/media/catalog/product/i/m/image_244363.jpg"
"099V";"Những Lớp Sóng - The Waves";"Virginia Woolf";"2021";"NXB Tổng Hợp TPHCM";"https://cdn0.fahasa.com/media/catalog/product/i/m/image_225232.jpg"
"100V";"Một Ngày Sau Cuối";"Mitch Albom";"2022";"NXB Kim Đồng";"https://cdn0.fahasa.com/media/wysiwyg/hieu_kd/2023-08-frame/FrameAds_03_1080X1080.png"